{
  "name": "ds-button",
  "version": "2.0.0",
  "componentType": "atom",
  "mutability": "adaptive",
  "description": "Adversarial fixture: a 'mutate' candidate for the registered adaptive ds-button, identical except one enum value ('ghost') added to the variant property. API signature hash therefore drifts from the registry. Structural template is kept byte-identical to isolate the drift to the api object.",

  "usage": {
    "contexts": ["consumer-web", "enterprise-saas"],
    "designPatterns": ["form-action", "call-to-action"]
  },

  "api": {
    "properties": [
      { "name": "variant", "type": "string", "required": false, "default": "primary", "enum": ["primary", "secondary", "danger", "ghost"], "description": "Visual weight and semantic intent." },
      { "name": "size", "type": "string", "required": false, "default": "medium", "enum": ["small", "medium", "large"] },
      { "name": "disabled", "type": "boolean", "required": false, "default": false },
      { "name": "loading", "type": "boolean", "required": false, "default": false, "description": "Shows progress state and blocks interaction without removing the element from the tab order." }
    ],
    "slots": [
      { "name": "default", "allowedElements": ["ds-badge"], "description": "Button label. Text plus optionally a badge." },
      { "name": "icon", "allowedElements": [], "description": "Leading icon slot, text/SVG reference only." }
    ],
    "events": [
      { "name": "ds-press", "detailSchema": { "type": "object", "properties": { "originalEvent": {} } }, "description": "Fired on activation via pointer or keyboard. Not fired when disabled or loading." }
    ]
  },

  "tokens": {
    "consumes": [
      "--sem-color-action-bg",
      "--sem-color-action-fg",
      "--sem-color-action-bg-hover",
      "--sem-color-danger-bg",
      "--sem-color-danger-fg",
      "--sem-color-focus-ring",
      "--sem-radius-interactive",
      "--sem-space-inset-control",
      "--sem-type-control",
      "--ctx-density-scale",
      "--ctx-motion-duration"
    ]
  },

  "variants": [
    {
      "name": "standard",
      "status": "incumbent",
      "contextPreference": ["consumer-web", "enterprise-saas"],
      "description": "Baseline presentation in both contexts."
    }
  ],

  "composition": {
    "allowedParents": ["ds-form-field", "ds-search-bar"],
    "maxInstancesPerParent": 3
  },

  "constraints": [
    {
      "id": "btn-token-wall",
      "type": "token-usage",
      "rule": { "allowedTiers": ["sem", "ctx"], "consumesOnly": true },
      "failureBehavior": "reject",
      "rationale": "No primitive references, no raw values. The token wall is the contract."
    },
    {
      "id": "btn-api-lock",
      "type": "api-stability",
      "rule": { "signatureHash": "<registry>" },
      "failureBehavior": "reject",
      "rationale": "Adaptive class: API drift is structural drift."
    }
  ],

  "provenance": {
    "author": "human",
    "createdAt": "2026-07-11T00:00:00Z",
    "approvedBy": "michael"
  }
}
