{
  "name": "ds-toggle-switch",
  "version": "1.0.0",
  "componentType": "atom",
  "mutability": "generative",
  "description": "Binary on/off switch for settings-style boolean input, alternative to a checkbox.",

  "usage": {
    "contexts": ["consumer-web", "enterprise-saas"]
  },

  "api": {
    "properties": [
      { "name": "checked", "type": "boolean", "required": false, "default": false },
      { "name": "disabled", "type": "boolean", "required": false, "default": false }
    ]
  },

  "tokens": {
    "consumes": [
      "--sem-color-action-bg",
      "--sem-color-action-fg",
      "--sem-color-input-border",
      "--sem-color-focus-ring",
      "--sem-radius-interactive",
      "--sem-space-inset-control",
      "--ctx-density-scale",
      "--ctx-motion-duration"
    ]
  },

  "constraints": [
    {
      "id": "toggle-token-wall",
      "type": "token-usage",
      "rule": { "allowedTiers": ["sem", "ctx"], "consumesOnly": true },
      "failureBehavior": "reject",
      "rationale": "No primitive references, no raw values."
    },
    {
      "id": "toggle-a11y",
      "type": "accessibility",
      "rule": { "standard": "wcag21aa", "rules": ["color-contrast", "focus-order-semantics"], "contexts": ["consumer-web", "enterprise-saas"] },
      "failureBehavior": "reject",
      "rationale": "Contrast between the track and its border must clear AA in both contexts; this first registration ships with no api.events, so a full keyboard-activation probe is deferred to the revision that adds the archetype-specific activation contract."
    },
    {
      "id": "toggle-api-lock",
      "type": "api-stability",
      "rule": { "signatureHash": "<registry>" },
      "failureBehavior": "reject",
      "rationale": "First registration establishes the API hash; later drift is a rejection."
    }
  ],

  "evolution": {
    "gate": { "metric": "task-completion-rate", "threshold": 0.05, "minSamples": 400, "windowDays": 14 }
  },

  "provenance": {
    "author": "ai",
    "model": "claude-sonnet-5",
    "createdAt": "2026-07-11T00:00:00Z",
    "justification": "Design decision: modeled `checked`/`disabled` directly on ds-checkbox's existing boolean-property pattern rather than introducing a three-way state. Rejected alternative: an `indeterminate` third state mirroring some native tri-state checkbox implementations. Rejected because the requirement's stated states are exactly on/off/disabled, and an indeterminate toggle switch has no clear visual or semantic meaning for a binary settings control (unlike a checkbox summarizing a group) — adding an unused state would be an unchecked, unjustified API surface. Kept the token set intentionally close to ds-button's (--sem-color-action-bg/fg, --sem-color-focus-ring) instead of inventing a parallel 'switch' palette, since a toggle switch is functionally an action-colored control."
  }
}
